{
  "$schema": "./companion.schema.json",
  "schemaVersion": 1,
  "dataVersion": "poc-2026-08-26.4",
  "minimumCoreVersion": "0.3.0",
  "featureFlags": {
    "panel": true,
    "eventObserver": true,
    "animations": true
  },
  "allowedAssetHosts": [
    "raw.githubusercontent.com",
    "res.cloudinary.com"
  ],
  "animations": [
    {
      "id": "ash-blossom-lonely-spring-effect",
      "trigger": {
        "eventType": "effect-declaration",
        "cardName": "Ash Blossom & Lonely Spring"
      },
      "presentation": {
        "preset": "petal-bloom-v1",
        "assetUrl": "https://res.cloudinary.com/vosvpv50/image/upload/f_auto,q_auto/ash_blossomm",
        "title": "Ash Blossom & Lonely Spring",
        "subtitle": "Effect Declared",
        "accentColor": "#f3a6c8",
        "durationMs": 3600
      },
      "frequency": "every-event"
    },
    {
      "id": "polyflora-hexbloom-effect",
      "trigger": {
        "eventType": "effect-declaration",
        "cardName": "Polyflora Hexbloom"
      },
      "presentation": {
        "preset": "arcane-bloom-v1",
        "assetUrl": "https://res.cloudinary.com/vosvpv50/image/upload/v1787763973/polyflora.png",
        "title": "Polyflora Hexbloom",
        "subtitle": "Pendulum Effect Declared",
        "accentColor": "#8ee6b0",
        "durationMs": 4600
      },
      "frequency": "every-event"
    }
  ]
}
